<?xml version = "1.0" encoding = "UTF-8"?>
<!--

    Copyright (c) 2018 Oracle and/or its affiliates. All rights reserved.

    This program and the accompanying materials are made available under the
    terms of the Eclipse Public License v. 2.0, which is available at
    http://www.eclipse.org/legal/epl-2.0.

    This Source Code may also be made available under the following Secondary
    Licenses when the conditions for such availability set forth in the
    Eclipse Public License v. 2.0 are satisfied: GNU General Public License,
    version 2 with the GNU Classpath Exception, which is available at
    https://www.gnu.org/software/classpath/license.html.

    SPDX-License-Identifier: EPL-2.0 OR GPL-2.0 WITH Classpath-exception-2.0

-->

<!DOCTYPE spec SYSTEM "https://raw.githubusercontent.com/eclipse-ee4j/jakartaee-tck/master/internal/docs/dtd/spec_assertions.dtd"[
<!ENTITY wsametadata_ch2 SYSTEM "wsametadata_ch2.xml">
<!ENTITY wsametadata_ch3 SYSTEM "wsametadata_ch3.xml">
<!ENTITY wsametadata_ch4 SYSTEM "wsametadata_ch4.xml">
<!ENTITY wsametadata_ch5 SYSTEM "wsametadata_ch5.xml">
]>

<?xml-stylesheet type="text/xsl" href="https://raw.githubusercontent.com/eclipse-ee4j/jakartaee-tck/master/internal/docs/xsl/spec_assertions.xsl"?>
<spec>
	<next-available-id>30000</next-available-id>

	<previous-id>29999</previous-id>
	<technology>WSAMetaData</technology>
	<id>WSAMD</id>
	<name>Web Services Addressing 1.0 - MetaData</name>
	<version>1.0</version>
	<location-names>            
		<chapters>
			<chapter id = "1" name = "Introduction">
				<sections>
					<section id = "1" name = "Notation Conventions"/>
					<section id = "2" name = "Namespaces"/>
				</sections>
			</chapter>
			<chapter id = "2" name = "Including WSDL Metadata in EPRs">
				<sections>			
					<section id = "1" name = "Referencing WSDL Metadata from an EPR"/>
					<section id = "2" name = "Embedding WSDL Metadata in an EPR"/>
                                </sections>
			</chapter>	
			<chapter id = "3" name = "Indicating Use of WS-Addressing">
				<sections>			
					<section id = "1" name = "WS-Policy Assertions"/>
					<section id = "1.1" name = "Addressing Assertion"/>
					<section id = "1.2" name = "AnonymousResponses Assertion"/>
					<section id = "1.3" name = "NonAnonymousResponses Assertion"/>
					<section id = "1.4" name = "Examples (Compact Form)"/>
					<section id = "1.5" name = "Examples (Normal Form)"/>
					<section id = "1.6" name = "Finding Compatible Policies"/>
				</sections>                                
			</chapter>	
			<chapter id = "4" name = "Specifying Message Addressing Properties in WSDL">
				<sections>			
					<section id = "1" name = "Extending WSDL Endpoints with an EPR"/>
					<section id = "1.1" name = "WSDL 2.0 Component Model Changes"/>
                                        <section id = "2" name = "Destination"/>
					<section id = "3" name = "Reference Parameters"/>
					<section id = "4" name = "Action"/>
					<section id = "4.1" name = "Explicit Association"/>
                                        <section id = "4.2" name = "Default Action Pattern for WSDL 2.0"/>
                                        <section id = "4.3" name = "WSDL 2.0 Component Model Changes"/>
					<section id = "4.4" name = "Default Action Pattern for WSDL 1.1"/>
				</sections>
			</chapter>
			<chapter id = "5" name = "WS-Addressing and WSDL Message Exchange Patterns">
				<sections>			
					<section id = "1" name = "WSDL 1.1 Message Exchange Patterns"/>
                                        <section id = "1.1" name = "One-way"/>
					<section id = "1.2" name = "Request-Response"/>
                                        <section id = "1.3" name = "Notification"/>
					<section id = "1.4" name = "Solicit-response"/>
					<section id = "2" name = "WSDL 2.0 Message Exchange Patterns"/>
					<section id = "2.1" name = "In-only"/>
					<section id = "2.2" name = "Robust In-only"/>
                                        <section id = "2.3" name = "In-out"/>
					<section id = "2.4" name = "In-optional-out"/>
                                        <section id = "2.5" name = "Out-only"/>
					<section id = "2.6" name = "Robust Out-only"/>
                                        <section id = "2.7" name = "Out-in"/>
					<section id = "2.8" name = "Out-optional-in"/>
				</sections>
			</chapter>			
			<chapter id = "6" name = "Conformance"/>
			<chapter id = "7" name = "References">
				<sections>			
					<section id = "1" name = "Normative"/>
					<section id = "2" name = "Informative"/>
				</sections>			
			</chapter>
		</chapters>
	</location-names>
	<assertions>
         &wsametadata_ch2;
         &wsametadata_ch3;
         &wsametadata_ch4;
         &wsametadata_ch5;         
	</assertions>
</spec>

