<?xml version = "1.0" encoding = "UTF-8"?>
<!--

    Copyright (c) 2018 Oracle and/or its affiliates. All rights reserved.

    This program and the accompanying materials are made available under the
    terms of the Eclipse Public License v. 2.0, which is available at
    http://www.eclipse.org/legal/epl-2.0.

    This Source Code may also be made available under the following Secondary
    Licenses when the conditions for such availability set forth in the
    Eclipse Public License v. 2.0 are satisfied: GNU General Public License,
    version 2 with the GNU Classpath Exception, which is available at
    https://www.gnu.org/software/classpath/license.html.

    SPDX-License-Identifier: EPL-2.0 OR GPL-2.0 WITH Classpath-exception-2.0

-->

<!DOCTYPE spec SYSTEM "https://raw.githubusercontent.com/eclipse-ee4j/jakartaee-tck/master/internal/docs/dtd/spec_assertions.dtd"[
<!ENTITY wsasoapbinding_ch4 SYSTEM "wsasoapbinding_ch4.xml">
<!ENTITY wsasoapbinding_ch5 SYSTEM "wsasoapbinding_ch5.xml">
<!ENTITY wsasoapbinding_ch6 SYSTEM "wsasoapbinding_ch6.xml">
]>

<?xml-stylesheet type="text/xsl" href="https://raw.githubusercontent.com/eclipse-ee4j/jakartaee-tck/master/internal/docs/xsl/spec_assertions.xsl"?>
<spec>
	<next-available-id>20000</next-available-id>

	<previous-id>19999</previous-id>
	<technology>WSASOAPBinding</technology>
	<id>WSASB</id>
	<name>Web Services Addressing 1.0 - SOAP Binding</name>
	<version>1.0</version>
	<location-names>
		<chapters>
			<chapter id = "1" name = "Introduction">
				<sections>
					<section id = "1" name = "Notation Conventions"/>
					<section id = "2" name = "Namespaces"/>
				</sections>
			</chapter>
			<chapter id = "2" name = "SOAP 1.2 Addression Feature">
				<sections>			
					<section id = "1" name = "Feature Name"/>
					<section id = "2" name = "Description"/>
					<section id = "3" name = "Properties"/>
					<section id = "4" name = "Interactions with Other SOAP Features"/>
				</sections>
			</chapter>	
			<chapter id = "3" name = "SOAP 1.2 Addressing 1.0 Module">
				<sections>			
					<section id = "1" name = "Module Name"/>
					<section id = "2" name = "Description"/>
					<section id = "2.1" name = "Sending Messages"/>
					<section id = "2.2" name = "Receiving Messages"/>
					<section id = "3" name = "Additional Infoset Items"/>
					<section id = "4" name = "Binding Message Addressing Properties"/>
					<section id = "5" name = "Relationship between SOAP Headers and transport-level properties"/>
				</sections>
			</chapter>	
			<chapter id = "4" name = "SOAP 1.1 Addressing 1.0 Extension">
				<sections>			
					<section id = "1" name = "Extension Name"/>
					<section id = "2" name = "Description"/>
				</sections>
			</chapter>
			<chapter id = "5" name = "Addresses in SOAP">
				<sections>			
					<section id = "1" name = "Use of Anonymous Address in SOAP Response Endpoints"/>
					<section id = "1.1" name = "SOAP 1.1/HTTP"/>
					<section id = "1.2" name = "SOAP 1.2"/>
					<section id = "2" name = "Use of Non-Anonymous Address in SOAP Response Endpoints"/>
					<section id = "2.1" name = "SOAP 1.1/HTTP"/>
					<section id = "2.2" name = "SOAP 1.2"/>
				</sections>
			</chapter>
			<chapter id = "6" name = "Faults">
				<sections>			
					<section id = "1" name = "SOAP 1.2 Fault Binding"/>
					<section id = "2" name = "SOAP 1.1 Fault Binding"/>
					<section id = "3" name = "Fault Detail Elements"/>
					<section id = "3.1" name = "Problem Header QName"/>
					<section id = "3.2" name = "Problem IRI"/>
					<section id = "3.3" name = "Problem Action"/>
					<section id = "3.4" name = "Retry After"/>
					<section id = "4" name = "Predefined Faults"/>
					<section id = "4.1" name = "Invalid Addressing Header"/>
					<section id = "4.1.1" name = "wsa:InvalidAddress"/>
					<section id = "4.1.2" name = "wsa:InvalidEPR"/>
					<section id = "4.1.3" name = "wsa:InvalidCardinality"/>
					<section id = "4.1.4" name = "wsa:MissingAddressInEPR"/>
					<section id = "4.1.5" name = "wsa:DuplicateMessageID"/>
					<section id = "4.1.6" name = "wsa:ActionMismatch"/>
					<section id = "4.1.7" name = "wsa:OnlyAnonymousAddressSupported"/>
					<section id = "4.1.8" name = "wsa:OnlyNonAnonymousAddressSupported"/>
					<section id = "4.2" name = "Message Addressing Header Required"/>
					<section id = "4.3" name = "Destination Unreachable"/>
					<section id = "4.4" name = "Action Not Supported"/>
					<section id = "4.5" name = "Endpoint Unavailable"/>
				</sections>
			</chapter>
			<chapter id = "7" name = "Security Considerations">
				<sections>			
					<section id = "1" name = "Establishing EPR Trust"/>
					<section id = "2" name = "Additional Security Considerations"/>
					<section id = "3" name = "Additional Considerations for SOAP Intermediaries"/>
				</sections>			
			</chapter>
			<chapter id = "8" name = "Conformance">
			</chapter>
			<chapter id = "9" name = "References">
				<sections>			
					<section id = "1" name = "Normative References"/>
					<section id = "2" name = "Other References"/>
				</sections>			
			</chapter>
		</chapters>
	</location-names>
	<assertions>
         &wsasoapbinding_ch4;
         &wsasoapbinding_ch5;
         &wsasoapbinding_ch6;
	</assertions>
</spec>

