<?xml version="1.0" encoding="UTF-8"?>
<!DOCTYPE spec SYSTEM "https://raw.githubusercontent.com/eclipse-ee4j/jakartaee-tck/master/internal/docs/dtd/spec_assertions.dtd">
<!--

    Copyright (c) 2018, 2020 Oracle and/or its affiliates. All rights reserved.

    This program and the accompanying materials are made available under the
    terms of the Eclipse Public License v. 2.0, which is available at
    http://www.eclipse.org/legal/epl-2.0.

    This Source Code may also be made available under the following Secondary
    Licenses when the conditions for such availability set forth in the
    Eclipse Public License v. 2.0 are satisfied: GNU General Public License,
    version 2 with the GNU Classpath Exception, which is available at
    https://www.gnu.org/software/classpath/license.html.

    SPDX-License-Identifier: EPL-2.0 OR GPL-2.0 WITH Classpath-exception-2.0

-->

<spec>
  <next-available-id>7000</next-available-id>
  <previous-id>0</previous-id>
  <technology>JWS</technology>
  <id>JWS</id>
  <name>Web Services Metadata for the JavaTM Platform</name>
  <version>2.0</version>
  <location>
    <chapters />
    <chapter id="3" name="Server Programming Model">
      <sections>
        <section id="3" name="Web Method" />
        <section id="2" name="Service Endpoint Interface" />
        <section id="1" name="Service Implementation Bean" />
      </sections>
    </chapter>
    <chapter id="5" name="Java Mapping To XML/WSDL">
      <sections>
        <section id="3" name="Web Method Mapping" />
        <section id="2" name="Web Service Class Mapping" />
        <section id="1" name="Service Endpoint Interface" />
      </sections>
    </chapter>
    <chapter id="4" name="Web Services Metadata">
      <sections>
        <section id="3" name="Annotation: jakarta.jws.Oneway" />
        <section id="4.3" name="Example" />
        <section id="6.2" name="Annotation Type Definition" />
        <section id="1.3" name="Example" />
        <section id="3.2" name="Annotation Type Definition" />
        <section id="5.1" name="Description" />
        <section id="2.1" name="Description" />
        <section id="1" name="Annotation: jakarta.jws.WebService" />
        <section id="6" name="Annotation: jakarta.jws.HandlerChain" />
        <section id="1.1" name="Description" />
        <section id="5" name="Annotation: jakarta.jws.WebResult" />
        <section id="2.3" name="Example" />
        <section id="4" name="Annotation: jakarta.jws.WebParam" />
        <section id="1.2" name="Annotation Type Definition" />
        <section id="2.2" name="Annotation Type Definition" />
        <section id="7" name="Annotation: jakarta.jws.SOAPBinding" />
        <section id="2" name="Annotation: jakarta.jws.WebMethod" />
        <section id="7.1" name="Description" />
        <section id="6.1" name="Description" />
        <section id="3.3" name="Example" />
        <section id="7.2" name="Annotation Type Definition" />
        <section id="4.1" name="Description" />
        <section id="5.3" name="Example" />
        <section id="3.1" name="Description" />
        <section id="7.3" name="Example" />
        <section id="4.2" name="Annotation Type Definition" />
        <section id="6.3" name="Example" />
        <section id="5.2" name="Annotation Type Definition" />
      </sections>
    </chapter>
    <chapter id="6" name="SOAP Binding">
      <sections>
        <section id="1.1" name="RPC Operation Style" />
        <section id="1.2.1" name="Document Bare Style" />
        <section id="1.2" name="Document Operation Style" />
        <section id="1" name="Operation Modes" />
      </sections>
    </chapter>
  </location>
  <assertions>
    <assertion required="true" impl-spec="false" defined-by="technology" status="active" testable="false">
      <id>3003</id>
      <description>The implementation MUST NOT define a finalize() method.</description>
      <location chapter="3" section="1" />
    </assertion>
    <assertion required="true" impl-spec="true" defined-by="technology" status="active" testable="false">
      <id>4001</id>
      <description>A JSR-181 processor is REQUIRED to report an error if an operation marked @Oneway has a return value, declares any checked exceptions or has any INOUT or OUT parameters.</description>
      <location chapter="4" section="3.1" />
    </assertion>
    <assertion required="true" impl-spec="false" defined-by="technology" status="active" testable="false">
      <id>4006</id>
      <description>The name attribute of HandlerChain annotation was originally used to associate a JAX-RPC handler in a handler chain with the web service it is declared in.  JAX-WS handlers are associated to web services via elements in the handler chain itself.  In this version, the name is ALWAYS ignored.</description>
      <location chapter="4" section="6.1" />
    </assertion>
    <assertion required="true" impl-spec="true" defined-by="technology" status="active" testable="false">
      <id>4008</id>
      <description>Implementations MUST report an error if the SOAPBinding annotation is placed on a method with a SOAPBinding.style of RPC.</description>
      <location chapter="4" section="7.1" />
    </assertion>
    <assertion required="true" impl-spec="false" defined-by="technology" status="active" testable="false">
      <id>5004</id>
      <description>Each wsdl:port MUST be of the same wsdl:portType, but MAY have different bindings.</description>
      <location chapter="5" section="2" />
    </assertion>
    <assertion required="true" impl-spec="false" defined-by="technology" status="active" testable="false">
      <id>5007</id>
      <description>The wsdl:service MUST contain a distinct wsdl:port for every transport endpoint supported by the service.</description>
      <location chapter="5" section="2" />
    </assertion>
  </assertions>
</spec>

