<?xml version = "1.0" encoding = "UTF-8"?>
<!DOCTYPE spec SYSTEM "https://raw.githubusercontent.com/eclipse-ee4j/jakartaee-tck/master/internal/docs/dtd/spec_assertions.dtd"[
<!--

    Copyright (c) 2018 Oracle and/or its affiliates. All rights reserved.

    This program and the accompanying materials are made available under the
    terms of the Eclipse Public License v. 2.0, which is available at
    http://www.eclipse.org/legal/epl-2.0.

    This Source Code may also be made available under the following Secondary
    Licenses when the conditions for such availability set forth in the
    Eclipse Public License v. 2.0 are satisfied: GNU General Public License,
    version 2 with the GNU Classpath Exception, which is available at
    https://www.gnu.org/software/classpath/license.html.

    SPDX-License-Identifier: EPL-2.0 OR GPL-2.0 WITH Classpath-exception-2.0

-->

<!ENTITY bp_ch3 SYSTEM "bp_ch3.xml">
<!ENTITY bp_ch4 SYSTEM "bp_ch4.xml">
<!ENTITY bp_ch5 SYSTEM "bp_ch5.xml">
<!ENTITY bp_ch6 SYSTEM "bp_ch6.xml">
]>

<?xml-stylesheet type="text/xsl" href="https://raw.githubusercontent.com/eclipse-ee4j/jakartaee-tck/master/internal/docs/xsl/spec_assertions.xsl"?>
<spec>
	<next-available-id>10000</next-available-id>
	<previous-id>9999</previous-id>
	<technology>WSIBasicProfile</technology>
	<id>WSI</id>
	<name>Basic Profile</name>
	<version>1.1</version>
	<location-names>
		<chapters>
               <chapter id = "3" name = "Messaging">
                    <sections>
                        <section id = "1" name = "SOAP Envelope"/>
                        <section id = "1.1" name = "SOAP Envelope Structure"/>
                        <section id = "1.2" name = "SOAP Envelope Namespace"/>
                        <section id = "1.3" name = "SOAP Body Namespace Qualification"/>
                        <section id = "1.4" name = "Disallowed Constructs"/>
                        <section id = "1.5" name = "SOAP Trailers"/>
                        <section id = "1.6" name = "SOAP encodingStyle Attribute"/>
                        <section id = "1.7" name = "SOAP mustUnderstand Attribute"/>
                        <section id = "1.8" name = "xsi:type Attributes"/>
                        <section id = "1.9" name = "SOAP1.1 attributes on SOAP1.1 elements"/>
                        <section id = "2" name = "SOAP Processing Model "/>
                        <section id = "2.1" name = "Mandatory Headers"/>
                        <section id = "2.2" name = "Generating mustUnderstand Faults"/>
                        <section id = "2.3" name = "SOAP Fault Processing"/>
                        <section id = "3" name = "SOAP Faults"/>
                        <section id = "3.1" name = "Identifying SOAP Faults"/>
                        <section id = "3.2" name = "SOAP Fault Structure"/>
                        <section id = "3.3" name = "SOAP Fault Namespace Qualification"/>
                        <section id = "3.4" name = "SOAP Fault Extensibility"/>
                        <section id = "3.5" name = "SOAP Fault Language"/>
                        <section id = "3.6" name = "SOAP Custom Fault Codes"/>
                        <section id = "4"   name = "Use of SOAP in HTTP"/>
                        <section id = "4.1" name = "HTTP Protocol Binding"/>
                        <section id = "4.2" name = "HTTP Methods and Extensions"/>
                        <section id = "4.3" name = "SOAPAction HTTP Header"/>
                        <section id = "4.4" name = "HTTP Success Status Codes"/>
                        <section id = "4.5" name = "HTTP Redirect Status Codes"/>
                        <section id = "4.6" name = "HTTP Client Error Status Codes"/>
                        <section id = "4.7" name = "HTTP Server Error Status Codes"/>
                        <section id = "4.8" name = "HTTP Cookies"/>
                    </sections>
               </chapter>
               <chapter id = "4" name = "Service Description">
                    <sections>
                        <section id = "1" name = "Required Description"/>
                        <section id = "2" name = "Document Structure"/>
                        <section id = "2.1" name = "WSDL Schema Definitions"/>
                        <section id = "2.2" name = "WSDL and Schema Import"/>
                        <section id = "2.3" name = "WSDL Import location Attribute Structure"/>
                        <section id = "2.4" name = "WSDL Import location Attribute Semantics"/>
                        <section id = "2.5" name = "Placement of WSDL import Elements"/>
                        <section id = "2.6" name = "XML Version Requirements"/>
                        <section id = "2.7" name = "XML Namespace declarations"/>
                        <section id = "2.8" name = "WSDL and the Unicode BOM"/>
                        <section id = "2.9" name = "Acceptable WSDL Character Encodings"/>
                        <section id = "2.10" name = "Namespace Coercion"/>
                        <section id = "2.11" name = "WSDL documentation Element"/>
                        <section id = "2.12" name = "WSDL Extensions"/>
                        <section id = "3" name = "Types"/>
                        <section id = "3.1" name = "QName References"/>
                        <section id = "3.2" name = "Schema targetNamespace Structure"/>
                        <section id = "3.3" name = "soapenc:Array"/>
                        <section id = "3.4" name = "WSDL and Schema Definition Target Namespaces"/>
                        <section id = "4" name = "Messages"/>
                        <section id = "4.1" name = "Bindings and Parts"/>
                        <section id = "4.2" name = "Bindings and Faults"/>
                        <section id = "4.3" name = "Declaration of part Elements"/>
                        <section id = "5" name = "Port Types"/>
                        <section id = "5.1" name = "Ordering of part Elements"/>
                        <section id = "5.2" name = "Allowed Operations"/>
                        <section id = "5.3" name = "Distinctive Operations"/>
                        <section id = "5.4" name = "parameterOrder Attribute Construction"/>
                        <section id = "5.5" name = "Exclusivity of type and element Attributes"/>
                        <section id = "6" name = "Bindings"/>
                        <section id = "6.1" name = "Use of SOAP Binding"/>
                        <section id = "7" name = "SOAP Binding"/>
                        <section id = "7.1" name = "Specifying the transport Attribute"/>
                        <section id = "7.2" name = "HTTP Transport"/>
                        <section id = "7.3" name = "Consistency of style Attribute"/>
                        <section id = "7.4" name = "Encodings and the use Attribute"/>
                        <section id = "7.5" name = "Multiple Bindings for portType Elements"/>
                        <section id = "7.6" name = "Operation Signatures"/>
                        <section id = "7.7" name = "Multiple Ports on an Endpoint"/>
                        <section id = "7.8" name = "Child Element for Document-Literal Bindings"/>
                        <section id = "7.9" name = "One-Way Operations"/>
                        <section id = "7.10" name = "Namespaces for soapbind Elements"/>
                        <section id = "7.11" name = "Consistency of portType and binding Elements"/>
                        <section id = "7.12" name = "Describing headerfault Elements"/>
                        <section id = "7.13" name = "Enumeration of Faults"/>
                        <section id = "7.14" name = "Type and Name of SOAP Binding Elements"/>
                        <section id = "7.15" name = "name Attribute on Faults"/>
                        <section id = "7.16" name = "Omission of the use Attribute"/>
                        <section id = "7.17" name = "Default for use Attribute"/>
                        <section id = "7.18" name = "Consistency of Envelopes with Descriptions"/>
                        <section id = "7.19" name = "Response Wrappers"/>
                        <section id = "7.20" name = "Part Accessors"/>
                        <section id = "7.21" name = "Namespaces for Children of Part Accessors"/>
                        <section id = "7.22" name = "Required Headers"/>
                        <section id = "7.23" name = "Allowing Undescribed Headers"/>
                        <section id = "7.24" name = "Ordering Headers"/>
                        <section id = "7.25" name = "Describing SOAPAction"/>
                        <section id = "7.26" name = "SOAP Binding Extensions"/>
                        <section id = "8" name = "Use of XML Schema"/>
                    </sections>
               </chapter>
               <chapter id = "5" name = "Service Publication and Discovery">
                    <sections>
                        <section id = "1" name = "bindingTemplates"/>
                        <section id = "2" name = "tModels"/>
                    </sections>
               </chapter>
               <chapter id = "6" name = "Security">
                    <sections>
                        <section id = "1" name = "Use of HTTPS"/>
                    </sections>
               </chapter>
		</chapters>
	</location-names>
	<assertions>
         &bp_ch3;
         &bp_ch4;
         &bp_ch5;
         &bp_ch6;
	</assertions>
</spec>
